[
  {
    "id": "haber-process",
    "title": "Haber process",
    "category": "Chemistry",
    "subcategory": "Equilibrium",
    "latex": "\\ce{N2 + 3H2 <=> 2NH3}",
    "description": "Nitrogen and hydrogen in equilibrium with ammonia.",
    "tags": [
      "chemistry",
      "equilibrium",
      "mhchem"
    ]
  },
  {
    "id": "water-autoionization",
    "title": "Water autoionization",
    "category": "Chemistry",
    "subcategory": "Equilibrium",
    "latex": "\\ce{2H2O <=> H3O+ + OH-}",
    "description": "Autoionization equilibrium of water.",
    "tags": [
      "chemistry",
      "equilibrium",
      "water",
      "mhchem"
    ]
  }
]
