[
  {
    "id": "acid-base-neutralization",
    "title": "Acid-base neutralization",
    "category": "Chemistry",
    "subcategory": "Ionic Reactions",
    "latex": "\\ce{H+ + OH- -> H2O}",
    "description": "Net ionic equation for strong acid-base neutralization.",
    "tags": [
      "chemistry",
      "acid-base",
      "ions",
      "mhchem"
    ]
  },
  {
    "id": "silver-chloride-precipitation",
    "title": "Silver chloride precipitation",
    "category": "Chemistry",
    "subcategory": "Ionic Reactions",
    "latex": "\\ce{Ag+ + Cl- -> AgCl v}",
    "description": "Precipitation reaction forming silver chloride.",
    "tags": [
      "chemistry",
      "ions",
      "precipitation",
      "mhchem"
    ]
  }
]
