[
  {
    "id": "harmonic-oscillator-energy",
    "title": "Quantum harmonic oscillator energy",
    "category": "Physics",
    "subcategory": "Quantum Mechanics",
    "latex": "E_n=\\hbar\\omega\\left(n+\\frac{1}{2}\\right)",
    "description": "Energy levels of the quantum harmonic oscillator.",
    "tags": [
      "physics",
      "quantum",
      "oscillator"
    ]
  },
  {
    "id": "heisenberg-uncertainty",
    "title": "Heisenberg uncertainty",
    "category": "Physics",
    "subcategory": "Quantum Mechanics",
    "latex": "\\Delta x\\,\\Delta p\\geq \\frac{\\hbar}{2}",
    "description": "Position-momentum uncertainty relation.",
    "tags": [
      "physics",
      "quantum",
      "uncertainty"
    ]
  },
  {
    "id": "planck-relation",
    "title": "Planck relation",
    "category": "Physics",
    "subcategory": "Quantum Mechanics",
    "latex": "E=h\\nu=\\hbar\\omega",
    "description": "Energy of a photon in terms of frequency.",
    "tags": [
      "physics",
      "quantum",
      "energy"
    ]
  },
  {
    "id": "schrodinger-equation",
    "title": "Schrodinger equation",
    "category": "Physics",
    "subcategory": "Quantum Mechanics",
    "latex": "i\\hbar\\pdv{\\Psi}{t}=\\hat{H}\\Psi",
    "description": "Time-dependent Schrodinger equation.",
    "tags": [
      "physics",
      "quantum",
      "schrodinger"
    ]
  }
]
