[
  {
    "id": "aligned-steps",
    "title": "Aligned steps",
    "category": "Algebra",
    "subcategory": "Layout",
    "latex": "\\begin{array}{rcl}\nA & = & B \\\\\n  & = & C \\\\\n  & = & D\n\\end{array}",
    "description": "Multi-line derivation layout.",
    "tags": [
      "algebra",
      "derivation",
      "layout"
    ]
  },
  {
    "id": "aligned-with-rule",
    "title": "Aligned with rule",
    "category": "Algebra",
    "subcategory": "Layout",
    "latex": "\\begin{array}{rcl}\nx+y&=&10 \\\\\nx-y&=&4 \\\\\n\\hline\n2x&=&14\n\\end{array}",
    "description": "Aligned equations with a separator rule.",
    "tags": [
      "algebra",
      "layout",
      "system"
    ]
  },
  {
    "id": "right-brace-note",
    "title": "Right brace note",
    "category": "Algebra",
    "subcategory": "Layout",
    "latex": "\\left.\n\\begin{array}{rcl}\na+b&=&c \\\\\nd+e&=&f\n\\end{array}\n\\right\\}\n\\quad \\text{conditions}",
    "description": "Equations grouped with a right-side brace note.",
    "tags": [
      "algebra",
      "brace",
      "annotation"
    ]
  }
]
