[
  {
    "id": "determinant-two-by-two",
    "title": "2 by 2 determinant",
    "category": "Linear Algebra",
    "subcategory": "Determinants",
    "latex": "\\begin{vmatrix}\na & b \\\\\nc & d\n\\end{vmatrix}=ad-bc",
    "description": "Closed form for a 2 by 2 determinant.",
    "tags": [
      "linear-algebra",
      "determinant",
      "matrix"
    ]
  }
]
