[
  {
    "id": "normal-distribution",
    "title": "Normal distribution",
    "category": "Probability",
    "subcategory": "Distributions",
    "latex": "f(x)=\\frac{1}{\\sigma\\sqrt{2\\pi}}e^{-\\frac{1}{2}\\left(\\frac{x-\\mu}{\\sigma}\\right)^2}",
    "description": "Probability density of a normal distribution.",
    "tags": [
      "probability",
      "statistics",
      "distribution"
    ]
  }
]
