[
  {
    "id": "matrix-vector-product",
    "title": "Matrix-vector product",
    "category": "Linear Algebra",
    "subcategory": "Matrices",
    "latex": "\\mathbf{A}\\mathbf{x}=\\begin{bmatrix}\na_{11} & a_{12} \\\\\na_{21} & a_{22}\n\\end{bmatrix}\\begin{bmatrix}\nx_1 \\\\\nx_2\n\\end{bmatrix}",
    "description": "A compact 2 by 2 matrix-vector product.",
    "tags": [
      "linear-algebra",
      "matrix",
      "vector"
    ]
  }
]
