[
  {
    "id": "gauss-law-integral",
    "title": "Gauss law",
    "category": "Physics",
    "subcategory": "Electromagnetism",
    "latex": "\\oint_{\\partial V}\\mathbf{E}\\cdot d\\mathbf{A}=\\frac{Q}{\\varepsilon_0}",
    "description": "Integral form of Gauss law for electricity.",
    "tags": [
      "physics",
      "electromagnetism",
      "maxwell"
    ]
  },
  {
    "id": "lorentz-force",
    "title": "Lorentz force",
    "category": "Physics",
    "subcategory": "Electromagnetism",
    "latex": "\\mathbf{F}=q\\left(\\mathbf{E}+\\mathbf{v}\\times\\mathbf{B}\\right)",
    "description": "Force on a charged particle in electric and magnetic fields.",
    "tags": [
      "physics",
      "electromagnetism",
      "force"
    ]
  },
  {
    "id": "maxwell-equations",
    "title": "Maxwell equations",
    "category": "Physics",
    "subcategory": "Electromagnetism",
    "latex": "\\begin{aligned}\n\\nabla \\cdot \\mathbf{E} &= \\frac{\\rho}{\\varepsilon_0} \\\\\n\\nabla \\cdot \\mathbf{B} &= 0 \\\\\n\\nabla \\times \\mathbf{E} &= -\\pdv{\\mathbf{B}}{t} \\\\\n\\nabla \\times \\mathbf{B} &= \\mu_0\\mathbf{J}+\\mu_0\\varepsilon_0\\pdv{\\mathbf{E}}{t}\n\\end{aligned}",
    "description": "Differential form of Maxwell equations.",
    "tags": [
      "physics",
      "electromagnetism",
      "maxwell"
    ]
  }
]
