[
  {
    "id": "substack-sum",
    "title": "Substack sum",
    "category": "Calculus",
    "subcategory": "Series",
    "latex": "\\sum_{\\substack{\n0 < i < m \\\\\n0 < j < n\n}} P(i,j)",
    "description": "Summation with stacked constraints.",
    "tags": [
      "calculus",
      "sum",
      "series"
    ]
  },
  {
    "id": "taylor-series",
    "title": "Taylor series",
    "category": "Calculus",
    "subcategory": "Series",
    "latex": "f(x)=\\sum_{n=0}^{\\infty}\\frac{f^{(n)}(a)}{n!}(x-a)^n",
    "description": "Taylor expansion of a smooth function around a point.",
    "tags": [
      "calculus",
      "series",
      "taylor"
    ]
  }
]
