[
  {
    "id": "newtons-second-law",
    "title": "Newton's second law",
    "category": "Physics",
    "subcategory": "Mechanics",
    "latex": "\\mathbf{F}=m\\mathbf{a}",
    "description": "Force equals mass times acceleration.",
    "tags": [
      "physics",
      "mechanics",
      "force"
    ]
  }
]
