[
  {
    "id": "covariance",
    "title": "Covariance",
    "category": "Probability",
    "subcategory": "Statistics",
    "latex": "\\operatorname{Cov}(X,Y)=E\\left[(X-E[X])(Y-E[Y])\\right]",
    "description": "Covariance of two random variables.",
    "tags": [
      "probability",
      "statistics",
      "covariance"
    ]
  }
]
