[
  {
    "id": "fourier-transform",
    "title": "Fourier transform",
    "category": "Calculus",
    "subcategory": "Transforms",
    "latex": "\\hat{f}(\\xi)=\\int_{-\\infty}^{\\infty} f(x)e^{-2\\pi i x \\xi}\\,dx",
    "description": "A common Fourier transform convention.",
    "tags": [
      "calculus",
      "integral",
      "fourier"
    ]
  }
]
