[
  {
    "id": "newtons-second-law",
    "title": "Newton's second law",
    "category": "Physics",
    "subcategory": "Mechanics",
    "latex": "\\mathbf{F}=m\\mathbf{a}",
    "description": "Force equals mass times acceleration.",
    "tags": [
      "physics",
      "mechanics",
      "force"
    ]
  },
  {
    "id": "euler-lagrange-equation",
    "title": "Euler-Lagrange equation",
    "category": "Physics",
    "subcategory": "Classical Mechanics",
    "latex": "\\pdv{L}{q}-\\dv{}{t}\\pdv{L}{\\dot{q}}=0",
    "description": "Euler-Lagrange equation for one generalized coordinate.",
    "tags": [
      "physics",
      "mechanics",
      "lagrangian"
    ]
  },
  {
    "id": "hamiltonian-definition",
    "title": "Hamiltonian definition",
    "category": "Physics",
    "subcategory": "Classical Mechanics",
    "latex": "H(q,p,t)=\\sum_i p_i\\dot{q}_i-L(q,\\dot{q},t)",
    "description": "Hamiltonian as a Legendre transform of the Lagrangian.",
    "tags": [
      "physics",
      "mechanics",
      "hamiltonian"
    ]
  },
  {
    "id": "schrodinger-equation",
    "title": "Schrodinger equation",
    "category": "Physics",
    "subcategory": "Quantum Mechanics",
    "latex": "i\\hbar\\pdv{\\Psi}{t}=\\hat{H}\\Psi",
    "description": "Time-dependent Schrodinger equation.",
    "tags": [
      "physics",
      "quantum",
      "schrodinger"
    ]
  },
  {
    "id": "planck-relation",
    "title": "Planck relation",
    "category": "Physics",
    "subcategory": "Quantum Mechanics",
    "latex": "E=h\\nu=\\hbar\\omega",
    "description": "Energy of a photon in terms of frequency.",
    "tags": [
      "physics",
      "quantum",
      "energy"
    ]
  },
  {
    "id": "einstein-relation",
    "title": "Einstein relation",
    "category": "Physics",
    "subcategory": "Relativity",
    "latex": "E=mc^2",
    "description": "Mass-energy equivalence.",
    "tags": [
      "physics",
      "relativity",
      "energy"
    ]
  },
  {
    "id": "ideal-gas-law",
    "title": "Ideal gas law",
    "category": "Physics",
    "subcategory": "Thermodynamics",
    "latex": "PV=nRT",
    "description": "Ideal gas equation of state.",
    "tags": [
      "physics",
      "thermodynamics",
      "gas"
    ]
  },
  {
    "id": "boltzmann-entropy",
    "title": "Boltzmann entropy",
    "category": "Physics",
    "subcategory": "Statistical Mechanics",
    "latex": "S=k_B\\ln\\Omega",
    "description": "Boltzmann formula for entropy.",
    "tags": [
      "physics",
      "entropy",
      "statistical-mechanics"
    ]
  },
  {
    "id": "gauss-law-integral",
    "title": "Gauss law",
    "category": "Physics",
    "subcategory": "Electromagnetism",
    "latex": "\\oint_{\\partial V}\\mathbf{E}\\cdot d\\mathbf{A}=\\frac{Q}{\\varepsilon_0}",
    "description": "Integral form of Gauss law for electricity.",
    "tags": [
      "physics",
      "electromagnetism",
      "maxwell"
    ]
  },
  {
    "id": "maxwell-equations",
    "title": "Maxwell equations",
    "category": "Physics",
    "subcategory": "Electromagnetism",
    "latex": "\\begin{aligned}\n\\nabla \\cdot \\mathbf{E} &= \\frac{\\rho}{\\varepsilon_0} \\\\\n\\nabla \\cdot \\mathbf{B} &= 0 \\\\\n\\nabla \\times \\mathbf{E} &= -\\pdv{\\mathbf{B}}{t} \\\\\n\\nabla \\times \\mathbf{B} &= \\mu_0\\mathbf{J}+\\mu_0\\varepsilon_0\\pdv{\\mathbf{E}}{t}\n\\end{aligned}",
    "description": "Differential form of Maxwell equations.",
    "tags": [
      "physics",
      "electromagnetism",
      "maxwell"
    ]
  },
  {
    "id": "lorentz-force",
    "title": "Lorentz force",
    "category": "Physics",
    "subcategory": "Electromagnetism",
    "latex": "\\mathbf{F}=q\\left(\\mathbf{E}+\\mathbf{v}\\times\\mathbf{B}\\right)",
    "description": "Force on a charged particle in electric and magnetic fields.",
    "tags": [
      "physics",
      "electromagnetism",
      "force"
    ]
  },
  {
    "id": "heisenberg-uncertainty",
    "title": "Heisenberg uncertainty",
    "category": "Physics",
    "subcategory": "Quantum Mechanics",
    "latex": "\\Delta x\\,\\Delta p\\geq \\frac{\\hbar}{2}",
    "description": "Position-momentum uncertainty relation.",
    "tags": [
      "physics",
      "quantum",
      "uncertainty"
    ]
  },
  {
    "id": "harmonic-oscillator-energy",
    "title": "Quantum harmonic oscillator energy",
    "category": "Physics",
    "subcategory": "Quantum Mechanics",
    "latex": "E_n=\\hbar\\omega\\left(n+\\frac{1}{2}\\right)",
    "description": "Energy levels of the quantum harmonic oscillator.",
    "tags": [
      "physics",
      "quantum",
      "oscillator"
    ]
  }
]
