[
  {
    "id": "fundamental-theorem-calculus",
    "title": "Fundamental theorem of calculus",
    "category": "Calculus",
    "subcategory": "Integrals",
    "latex": "\\int_a^b f'(x)\\,dx=f(b)-f(a)",
    "description": "Integral of a derivative over an interval.",
    "tags": [
      "calculus",
      "integral",
      "derivative"
    ]
  }
]
